{
    "modules": ["User Management", "Task Management"],
    "features_by_module": {
        "User Management": ["Register new users", "Login/logout", "Profile update"],
        "Task Management": ["Create tasks", "Assign tasks", "Track task status"]
    },
    "user_stories": [
        {
            "id": "US001",
            "as_a": "new user",
            "i_want": "to register an account",
            "so_that": "I can access the system",
            "module": "User Management"
        },
        {
            "id": "US002",
            "as_a": "logged-in user",
            "i_want": "to create a task",
            "so_that": "I can organize my work",
            "module": "Task Management"
        }
    ],
    "api_endpoints": [
        {
            "method": "POST",
            "path": "/api/users/register",
            "description": "Register a new user",
            "auth_required": false,
            "request_body": {
                "username": "string",
                "password": "string",
                "email": "string"
            },
            "response": {
                "user_id": "integer",
                "message": "string"
            },
            "errors": [
                { "code": 400, "message": "Invalid input" },
                { "code": 409, "message": "User already exists" }
            ]
        }
    ],
    "db_schema": [
        {
            "table_name": "users",
            "columns": [
                { "name": "id", "type": "INTEGER", "constraints": ["PRIMARY KEY", "AUTOINCREMENT"], "nullable": false },
                { "name": "username", "type": "TEXT", "constraints": ["UNIQUE"], "nullable": false },
                { "name": "password_hash", "type": "TEXT", "nullable": false },
                { "name": "email", "type": "TEXT", "constraints": ["UNIQUE"], "nullable": false }
            ],
            "relationships": ["tasks.user_id REFERENCES users(id)"]
        }
    ],
    "open_questions": [
        "How should password recovery be handled?",
        "What are the possible task statuses?"
    ]
}